{
  "$schema": "https://json-schema.org/draft/2020-12/schema",
  "$id": "https://cerebralhelm.local/schemas/tools/note-read-output.schema.json",
  "title": "CerebralHelm Note Read Output",
  "type": "object",
  "additionalProperties": false,
  "required": ["root", "path", "title", "frontmatter", "body"],
  "properties": {
    "root": {
      "type": "string",
      "minLength": 1,
      "description": "The absolute path of the knowledge root the note was read from; joined with `path` it is the note's source location."
    },
    "path": {
      "type": "string",
      "minLength": 3,
      "pattern": "^[^/].*\\.md$",
      "description": "The note's path relative to the knowledge root."
    },
    "title": {
      "type": "string",
      "minLength": 1,
      "description": "The frontmatter title when the note declares one, else its filename."
    },
    "noteId": {
      "type": "string",
      "minLength": 1,
      "description": "The CerebralHelm note id from frontmatter; absent for a note authored elsewhere."
    },
    "frontmatter": {
      "type": "object",
      "additionalProperties": { "type": "string" },
      "description": "The note's frontmatter exactly as parsed, including keys CerebralHelm does not write — the file is the source of truth, so nothing in it is dropped on the way out."
    },
    "body": {
      "type": "string",
      "description": "The Markdown body, verbatim, with the frontmatter block removed. Redacted out of the operational log by the descriptor: a note body never reaches a tool_calls row."
    },
    "updated": {
      "type": "string",
      "minLength": 1,
      "description": "ISO-8601. The frontmatter `updated` when present, else the file's modification date."
    }
  }
}
