{
  "root": "/Users/fixture/CerebralHelm/knowledge",
  "path": "projects/atlas/kickoff.md",
  "title": "Atlas kickoff",
  "noteId": "ch-note-001",
  "frontmatter": {
    "schemaVersion": "1.0.0",
    "id": "ch-note-001",
    "title": "Atlas kickoff",
    "kind": "note",
    "project": "atlas",
    "sensitivity": "private",
    "cloudPolicy": "deny",
    "status": "active",
    "created": "2026-06-23T18:04:00Z",
    "updated": "2026-06-23T18:04:00Z"
  },
  "body": "Deterministic fixture note body.\n",
  "updated": "2026-06-23T18:04:00Z"
}
